<?xml version="1.0" encoding="UTF-8"?>
<fichas xmlns:xsi="http://www.w3.org/2001/XMLSchema-instance"
    xsi:noNamespaceSchemaLocation="Ejercicio10_InicialesPersonasFamosas.xsd">
    <ficha>
        <nombre>Antonio Machado Ruiz</nombre>
        <iniciales>AMR</iniciales>
        <edad>22</edad>
    </ficha>
    <ficha>
        <nombre>Mario Moreno</nombre>
        <!-- añadimos una M mas ya que deben de ser tres no dos -->
        <iniciales>MMM</iniciales>
        <edad>23</edad>
    </ficha>
    <ficha>
        <!-- cambiamos el orden entre iniciales y nombre -->
        <nombre>Ada Lovelace</nombre>
        <iniciales>ALO</iniciales>
        <edad>24</edad>
    </ficha>
    <ficha>
        <nombre>pablo ruiz picasso</nombre>
        <!-- tiene que ser en mayusculas las iniciales -->
        <iniciales>PRP</iniciales>
        <edad>24</edad>
    </ficha>
</fichas> 